{
  "id": "scen.1979_stagflation",
  "date": "1979-08",
  "name": "scen.1979_stagflation.name",
  "desc": "scen.1979_stagflation.desc",
  "vars": {
    "inflation": 0.114,
    "unemployment": 0.058,
    "credibility": 25,
    "expectations_anchor": 0.09,
    "policy_rate": 0.1075,
    "months_below_anchor": 6,
    "balance_sheet": 0.08,
    "bank_fragility": 0.3,
    "independence": 78
  },
  "flags": {},
  "playable": true,
  "briefing": "brief.1979_q3_stagflation"
}
